A1: Weather Data: Cited from NASA's Weather Site at http://www.giss.nasa.gov
A2: New York City: Weather Station at Central Park
A3: YEAR | B3: JAN | C3: FEB | D3: MAR | E3: APR | F3: MAY | G3: JUN | H3: JUL | I3: AUG | J3: SEP | K3: OCT | L3: NOV | M3: DEC | N3: AVE | O3: HIGH | P3: LOW
A4: 1992 | B4: 36 | C4: 36 | D4: 40 | E4: 51 | F4: 61 | G4: 70 | H4: 74 | I4: 73 | J4: 67 | K4: 55 | L4: 47 | M4: 38 | N4: =AVERAGE(B4:M4) -> 54 | O4: =MAX(B4:M4) -> 74 | P4: =MIN(B4:M4) -> 36
A5: 1993 | B5: 36 | C5: 31 | D5: 40 | E5: 53 | F5: 66 | G5: 73 | H5: 80 | I5: 77 | J5: 67 | K5: 56 | L5: 49 | M5: 37 | N5: =AVERAGE(B5:M5) -> 55.416666666666664 | O5: =MAX(B5:M5) -> 80 | P5: =MIN(B5:M5) -> 31
A6: 1994 | B6: 26 | C6: 31 | D6: 41 | E6: 56 | F6: 62 | G6: 75 | H6: 79 | I6: 74 | J6: 68 | K6: 58 | L6: 52 | M6: 42 | N6: =AVERAGE(B6:M6) -> 55.333333333333336 | O6: =MAX(B6:M6) -> 79 | P6: =MIN(B6:M6) -> 26
A7: 1995 | B7: 38 | C7: 32 | D7: 45 | E7: 52 | F7: 62 | G7: 72 | H7: 79 | I7: 79 | J7: 68 | K7: 62 | L7: 44 | M7: 32 | N7: =AVERAGE(B7:M7) -> 55.416666666666664 | O7: =MAX(B7:M7) -> 79 | P7: =MIN(B7:M7) -> 32
A8: 1996 | B8: 31 | C8: 34 | D8: 39 | E8: 52 | F8: 61 | G8: 71 | H8: 73 | I8: 74 | J8: 68 | K8: 56 | L8: 43 | M8: 41 | N8: =AVERAGE(B8:M8) -> 53.583333333333336 | O8: =MAX(B8:M8) -> 74 | P8: =MIN(B8:M8) -> 31
A9: 1997 | B9: 32 | C9: 40 | D9: 42 | E9: 52 | F9: 59 | G9: 71 | H9: 76 | I9: 73 | J9: 67 | K9: 57 | L9: 44 | M9: 38 | N9: =AVERAGE(B9:M9) -> 54.25 | O9: =MAX(B9:M9) -> 76 | P9: =MIN(B9:M9) -> 32
A10: 1998 | B10: 40 | C10: 41 | D10: 45 | E10: 54 | F10: 64 | G10: 69 | H10: 76 | I10: 77 | J10: 70 | K10: 58 | L10: 48 | M10: 43 | N10: =AVERAGE(B10:M10) -> 57.083333333333336 | O10: =MAX(B10:M10) -> 77 | P10: =MIN(B10:M10) -> 40
A11: 1999 | B11: 34 | C11: 39 | D11: 42 | E11: 53 | F11: 63 | G11: 73 | H11: 81 | I11: 76 | J11: 69 | K11: 56 | L11: 51 | M11: 40 | N11: =AVERAGE(B11:M11) -> 56.416666666666664 | O11: =MAX(B11:M11) -> 81 | P11: =MIN(B11:M11) -> 34
A12: 2000 | B12: 31 | C12: 37 | D12: 47 | E12: 51 | F12: 64 | G12: 71 | H12: 72 | I12: 73 | J12: 66 | K12: 57 | L12: 45 | M12: 31 | N12: =AVERAGE(B12:M12) -> 53.75 | O12: =MAX(B12:M12) -> 73 | P12: =MIN(B12:M12) -> 31
A13: 2001 | B13: 34 | C13: 36 | D13: 40 | E13: 54 | F13: 64 | G13: 73 | H13: 73 | I13: 79 | J13: 68 | K13: 58 | L13: 53 | M13: 44 | N13: =AVERAGE(B13:M13) -> 56.333333333333336 | O13: =MAX(B13:M13) -> 79 | P13: =MIN(B13:M13) -> 34
A15: Summary of Data From 1992 - 2001:
A16: Highest monthly temperature | F16: =MAX(B4:M13) -> 81
A17: Lowest monthly temperature | F17: =MIN(B4:M13) -> 26
A18: Average monthly temperature | F18: =AVERAGE(B4:M13) -> 55.158333333333331