E1: Weekly Profit | F1: Total Profit in US$ | G1: Total Profit in GB
A2: Week | B2: Expenses | C2: Number Sold | D2: Cost Per Isssue
A3: 1 | B3: 53.19 | C3: 115 | D3: 1 | E3: =(D3*C3)-B3 -> 61.81 | F3: =E3 -> 61.81 | G3: =F3/$G$32 -> 42.861105332501218
A4: 2 | B4: 54.1 | C4: 37 | D4: 1 | E4: =(D4*C4)-B4 -> -17.1 | F4: =F3+E4 -> 44.71 | G4: =F4/$G$32 -> 31.003397822619792
A5: 3 | B5: 63.98 | C5: 35 | D5: 1 | E5: =(D5*C5)-B5 -> -28.98 | F5: =F4+E5 -> 15.73 | G5: =F5/$G$32 -> 10.907704042715487
A6: 4 | B6: 37.51 | C6: 175 | D6: 1 | E6: =(D6*C6)-B6 -> 137.49 | F6: =F5+E6 -> 153.22 | G6: =F6/$G$32 -> 106.24783302128843
A7: 5 | B7: 60.64 | C7: 104 | D7: 1 | E7: =(D7*C7)-B7 -> 43.36 | F7: =F6+E7 -> 196.58 | G7: =F7/$G$32 -> 136.31509604049654
A8: 6 | B8: 39.72 | C8: 2 | D8: 1 | E8: =(D8*C8)-B8 -> -37.72 | F8: =F7+E8 -> 158.86 | G8: =F8/$G$32 -> 110.15879619998617
A9: 7 | B9: 43.93 | C9: 99 | D9: 1 | E9: =(D9*C9)-B9 -> 55.07 | F9: =F8+E9 -> 213.93 | G9: =F9/$G$32 -> 148.34616184730604
A10: 8 | B10: 37.88 | C10: 183 | D10: 1 | E10: =(D10*C10)-B10 -> 145.12 | F10: =F9+E10 -> 359.05 | G10: =F10/$G$32 -> 248.97718604812431
A11: 9 | B11: 53.47 | C11: 47 | D11: 1 | E11: =(D11*C11)-B11 -> -6.47 | F11: =F10+E11 -> 352.58 | G11: =F11/$G$32 -> 244.49067332362532
A12: 10 | B12: 62.82 | C12: 127 | D12: 1 | E12: =(D12*C12)-B12 -> 64.18 | F12: =F11+E12 -> 416.76 | G12: =F12/$G$32 -> 288.99521531100481
A13: 11 | B13: 57.31 | C13: 179 | D13: 1 | E13: =(D13*C13)-B13 -> 121.69 | F13: =F12+E13 -> 538.45 | G13: =F13/$G$32 -> 373.37909992372238
A14: 12 | B14: 55.69 | C14: 19 | D14: 1 | E14: =(D14*C14)-B14 -> -36.69 | F14: =F13+E14 -> 501.76 | G14: =F14/$G$32 -> 347.93703626655576
A15: 13 | B15: 37.3 | C15: 22 | D15: 1.25 | E15: =(D15*C15)-B15 -> -9.8 | F15: =F14+E15 -> 491.96 | G15: =F15/$G$32 -> 341.14139102697459
A16: 14 | B16: 62.78 | C16: 186 | D16: 1.25 | E16: =(D16*C16)-B16 -> 169.72 | F16: =F15+E16 -> 661.68 | G16: =F16/$G$32 -> 458.83087164551699
A17: 15 | B17: 56.86 | C17: 4 | D17: 1.25 | E17: =(D17*C17)-B17 -> -51.86 | F17: =F16+E17 -> 609.82 | G17: =F17/$G$32 -> 422.8694265307538
A18: 16 | B18: 63.08 | C18: 89 | D18: 1.25 | E18: =(D18*C18)-B18 -> 48.17 | F18: =F17+E18 -> 657.99 | G18: =F18/$G$32 -> 456.27210318285836
A19: 17 | B19: 55.03 | C19: 194 | D19: 1.25 | E19: =(D19*C19)-B19 -> 187.47 | F19: =F18+E19 -> 845.46 | G19: =F19/$G$32 -> 586.27002288329527
A20: 18 | B20: 38.4 | C20: 32 | D20: 1.25 | E20: =(D20*C20)-B20 -> 1.6 | F20: =F19+E20 -> 847.06 | G20: =F20/$G$32 -> 587.37951598363509
A21: 19 | B21: 51.58 | C21: 39 | D21: 1.25 | E21: =(D21*C21)-B21 -> -2.83 | F21: =F20+E21 -> 844.23 | G21: =F21/$G$32 -> 585.41710006240908
A22: 20 | B22: 55.78 | C22: 108 | D22: 1.25 | E22: =(D22*C22)-B22 -> 79.22 | F22: =F21+E22 -> 923.45 | G22: =F22/$G$32 -> 640.35087719298247
A23: 21 | B23: 49.5 | C23: 167 | D23: 1.25 | E23: =(D23*C23)-B23 -> 159.25 | F23: =F22+E23 -> 1082.7 | G23: =F23/$G$32 -> 750.78011233617644
A24: 22 | B24: 48.64 | C24: 97 | D24: 1.25 | E24: =(D24*C24)-B24 -> 72.61 | F24: =F23+E24 -> 1155.31 | G24: =F24/$G$32 -> 801.13029609597118
A25: 23 | B25: 48.5 | C25: 167 | D25: 1.25 | E25: =(D25*C25)-B25 -> 160.25 | F25: =F24+E25 -> 1315.56 | G25: =F25/$G$32 -> 912.2529644268775
A26: 24 | B26: 53.04 | C26: 156 | D26: 1.25 | E26: =(D26*C26)-B26 -> 141.96 | F26: =F25+E26 -> 1457.52 | G26: =F26/$G$32 -> 1010.6927397545247
A27: 25 | B27: 58.58 | C27: 127 | D27: 1.25 | E27: =(D27*C27)-B27 -> 100.17 | F27: =F26+E27 -> 1557.69 | G27: =F27/$G$32 -> 1080.1539421676723
A28: 26 | B28: 38.88 | C28: 15 | D28: 1.25 | E28: =(D28*C28)-B28 -> -20.13 | F28: =F27+E28 -> 1537.56 | G28: =F28/$G$32 -> 1066.1951320990222
A29: Total Profit | E29: =SUM(E3:E28) -> 1537.56
A30: Maxium Profit in One Week | E30: =MAX(E3:E28) -> 187.47
A31: Maxium Loss in One Week | E31: =MIN(E3:E28) -> -51.86
A32: Current Conversion Rate: British ₤ to US $ | G32: 1.4420999999999999